,cluster,text
601,0,in fact shameless bjp also trying trade people health promising free vid vaccine biharin fact shameless bjp also trying trade people health promising free vid vaccine bihar manifesto
491,0,how anyone responsible scientists developing vaccine mpanies responded
1345,0,they random crap without nsidering nsequences trump administration shut vaccine safety
1621,0,what bihar thinks today us thinks tomorrow
737,0,man dies vid vaccine trials bbc say nothing worry yeah right
927,0,oh sorry said japan grinning face sweat ever visit vaccine
617,0,inject every one gates vid vaccine
1390,0,this trumps virus unfounately world virus one person held responsible
1045,0,ronavirus oxford astrazeneca vaccine behaves desired analysis finds
1029,0,remind us change handling virus more
,cluster,text
4613,1,gerl received results vaccine survey said 75 people would happy vid vaccine find thisjust received results vaccine survey said 75 people would happy vid vaccine find hard believe curious see even slighty pls
1799,1,astrazeneca watch repos vid vaccine trial volunteer died source
15836,1,vid 19 vaccine nevada safe
8561,1,my gender fluid vaccine
12977,1,the fda hits snag vid vaccine process public marketwatch thumbs up
7327,1,jai sree ram hope announce vid vaccine release date eagerly waiting sir
14832,1,trials going well brazilian dies vid 19 vaccine trial via
17806,1,yes yes yes
7244,1,it real virus get vaccine vid need sta living lives again
4943,1,governor abbott flu vaccine effective way prevent spread influenza expanding access to
,cluster,text
183,2,flu cases getting flu vaccine also getting vaccine virus aflu cases getting flu vaccine also getting vaccine virus survival rate 99 98 vid 19 nothing overly politicized flu
150,2,elderly ignoring rules pain isolation seeing family muchelderly ignoring rules pain isolation seeing family much bare dementia rates risen since vid 19 arrived damage people mental health wellbeing worse risk vid 19 isolate vaccine mes
533,2,the trump administration shut vaccine safety office last year plan new york times
214,2,here impoant questions meera nobody talking problematic itolizumab trials
58,2,another trump administration move endangers american people trump administration shut vaccine safetyanother trump administration move endangers american people trump administration shut vaccine safety office last year plan new york times
570,2,this first armed police used stop protest anti demo way things going
23,2,a vid vaccine aspirational reality vaccinated 100 morninga vid vaccine aspirational reality vaccinated 100 morning means fewer fevers days self isolation vid swabs circulating flu microbe need waay heroes get vaccinated
340,2,my op ed rapid development vid vaccines administration undermine progressmy op ed rapid development vid vaccines administration undermine progress thwa established regulatory process assuring safety effectiveness shocut final critical steps
339,2,my body shall hoax inseed shall mply period
659,2,who taps crusader sway public opinion vid vaccine children health defense
,cluster,text
1,0,1 double exclamation mark beaware double exclamation mark skull crossbones microbe dna syringe warning protection 99 9 survival rate warning total ntrol warning fear warning sdouble exclamation mark beaware double exclamation mark skull crossbones microbe dna syringe warning protection 99 9 survival rate warning total ntrol warning fear warning loosing freedom warning altering dna alarm clock wake time backhand index pointing down
123,0,astrazeneca resumes us vid 19 vaccine trial astrazeneca resumes us vid 19 vaccine trial
885,0,relieved see people blinding voting modi
732,0,no way track safety effects vaccines trump unfit office shut vaccine safety office
1061,0,the trump admin shut vaccine safety office last year plan office dedicated the
1209,0,trump ntinues shut progress monitor vaccine safety plan trumptrump ntinues shut progress monitor vaccine safety plan trump administration shut vaccine safety office last year plan
1329,0,want know luciferase gene loaded cs qdots self
1337,0,we forced take flu shots forced take vaccine vid 19
365,0,good listening science best way go
1161,0,this guy much learn modi guy much learn modi
,cluster,text
175,1,breaking trump administration quietly closed vaccine safety office last year hering effos track long termbreaking trump administration quietly closed vaccine safety office last year hering effos track long term safety ronavirus vaccine
22,1,a fascinating disturbing read vaccine trials us police car light spoiler ale using poor
758,1,so much children much children
2,1,20 volunteers suffer serious reactions johnson vid 19 vaccine vaccine reaction 20 volunteers suffer serious reactions johnson vid 19 vaccine vaccine reaction
923,1,there still vaccine mmon ld also ronavirus sure that
48,1,again flu vaccine people die chose uld get vaccine
1033,1,unbelievable trump gets 1 000 volunteers vid19 vaccine guinea pigs thenunbelievable trump gets 1 000 volunteers vid19 vaccine guinea pigs hides fact closed vaccine safety office last year thus die harder pin cause let dog take trump vaccine
292,1,francesca wrong malevolent deadly inmpetence francesca wrong malevolent deadly inmpetence
918,1,there need vaccine need vaccine
1100,1,visit visit
,cluster,text
3492,2,fda finally allows astrazeneca resta us vid 19 vaccine trials
8722,2,please retweet
945,2,and flu vaccine changes every year different strain flu vaccine changes every year different strain
4517,2,historic right good way
51,2,1 hines gotta remind em sho term memory shot vid king cult
5461,2,if pinning hopes vid vaccine dose realism via seed
12171,2,this super trumper know lied told ronavirus vaccine trail absolutely nothing said itthis super trumper know lied told ronavirus vaccine trail absolutely nothing said true cracks up
4769,2,i believe joe said mandatory vaccines volunteer vid 19 vaccine trial dies health officials
12849,2,until pog mehole hints get vaccine sir patrick vallance says disease might never
12240,2,this would good think actually fascinating nsideredthis would good think actually fascinating nsidered universally positive delivering forms healthcare americans free not
,cluster,text
460,3,nothing unusual vaccines
541,3,right arrow physicians believe development vaccine may enough prevent ronavirus beming endemicright arrow physicians believe development vaccine may enough prevent ronavirus beming endemic speaking head know going sta living virus chronic way backhand index pointing full story
255,3,g lewis breaking news volunteer astrazeneca oxford ronavirus vaccine trial dies brazilbreaking news volunteer astrazeneca oxford ronavirus vaccine trial dies brazil
714,3,vaccine ccmb developing three tech
271,3,half billion syringes stockpiled vid vaccine good news planning well also sign of
470,3,oh shocked someone died forgive surprise surprise whatoh shocked someone died forgive surprise surprise total psychopath would let family member test drive total scientific frankenstinien monster
246,3,former president says bolsonaro needs impeached refusing buy sinovac theformer president says bolsonaro needs impeached refusing buy sinovac vaccine made chinese lab ideological reasons lula accuses bolsonaro mmitting brazil ronavirus death toll passes 150 000
69,3,astrazenaca vid 19 vaccine trail volunteer dies says brazilian health authority anvisa testing the
838,3,yeah yeah
143,3,brazilian volunteer oxford vid vaccine trial dies say officials
,cluster,text
1805,4,never trust pharma news never ever
1445,4,if upto nirmala sitharaman would made arrangements vid vaccine polling stations in
274,4,another idiot understand way vaccination programs run
2747,4,the trump administration shut vaccine safety office last year plan carl zimmer
1758,4,more safety data remmended vaccines public trust equals success said sheldon toubman the
782,4,clear provided state govts foot bill clear provided state govts foot bill
2862,4,thinking face thinking face urse say lol vaccine literal poison ill surprised anyone makes out
3271,4,vid vaccine politics pukewohy directly face whoever promising vid vaccine politics pukewohy directly face whoever promising this
3025,4,uk infect volunteers vid vaccine trial us may allow astrazeneca trials
1425,4,if pinning hopes vid vaccine dose realism pinning hopes vid vaccine dose realism
,cluster,text
11171,0,they brainwashing children
1970,0,brazilian president rejects chinese vaccine wise move brazilian president rejects chinese vaccine wise move
1410,0,astrazeneca vid 19 vaccine trial volunteer dies says brazil astrazeneca vid 19 vaccine trial volunteer dies says brazil
11664,0,this tells us exactly need know people die us trying produce safe effective vaccine
7260,0,no surprise blaming death ronavirus take long it
500,0,a volunteer astra vid 19 vaccine trial died brazil volunteer astra vid 19 vaccine trial died brazil
10847,0,the vaccine help already ntracted ronavirus ogre
10221,0,that lovely vid existence 99 time ok evening nice evening and
5787,0,it one way positive test rate suppose
12819,0,vid 19 vaccine trials astrazeneca johnson johnson resta vid 19 vaccine trials astrazeneca johnson johnson resta
,cluster,text
1661,1,people need wake up
2860,1,yeah wait
2230,1,this god let us vid 19 vaccine
2076,1,the fda approves remdesivir first drug treating vid 19 ap vaccine
2392,1,vaccine trial ntinue says oxford volunteer dies vaccine trial ntinue says oxford volunteer dies
808,1,express ronavirus horror volunteer oxford vid 19 vaccine trial dies
1837,1,ronavirus vaccine update astrazeneca oxford vaccine trial volunteer dies brazil tests ntinue
1550,1,of urse urse
1779,1,rhinoviruses act vaccine ld protected vid see
1675,1,pfizer urge clarity fda future vid 19 vaccine trials vaccine availablepfizer urge clarity fda future vid 19 vaccine trials vaccine available
,cluster,text
45,2,after health minister announced purchase vid 19 vaccine developed chinese
1053,2,vaccine unlikely eradicate vid sir patrick vallance prof
118,2,because urse see evil monkey
1031,2,unbelievable trump gets 1 000 volunteers vid19 vaccine guinea pigs hides factunbelievable trump gets 1 000 volunteers vid19 vaccine guinea pigs hides fact closed vaccine safety office last year thus die harder pin cause let dog take trump vaccine
1168,2,wisnsin public radio boss require get vid 19 vaccine husch blackwell
892,2,the trump administration shut vaccine safety office last year plan thanks trump pouting face
1198,2,you suckers mine nothing like trying brand new vaccine zero long term studies rather
134,2,biden says ronavirus vaccine must freely available everyone biden says ronavirus vaccine must freelybiden says ronavirus vaccine must freely available everyone biden says ronavirus vaccine must freely available everyone
1162,2,why shut vaccine safety protect americans what
373,2,i going ntinue sharing ngresswoman plan vid 19 infect 200 million americansi going ntinue sharing ngresswoman plan vid 19 infect 200 million americans deadly disease cure vaccine
,cluster,text
564,3,that man lol
61,3,astrazeneca tipped resta vid 19 vaccine trial week repo
50,3,ariva indian society infected mmunal virus serious ronavirus virus infectsindian society infected mmunal virus serious ronavirus virus infects hollows brain unfounately cure vaccine dr thol thirumavalavan
159,3,don worry everyone guy died take vid vaccine different vaccine owndon worry everyone guy died take vid vaccine different vaccine saline placebo trial kids already forced get
286,3,if trump elected ronavirus vaccine program descend cronyism looting chaos notif trump elected ronavirus vaccine program descend cronyism looting chaos necessarily bad outme billions doses available neither dems republicans want take toxic untested unsafe vaccines
171,3,every time turn around trump sabotages ronavirus effos trump administration shut vaccine safety
128,3,bugger off
460,3,poole volunteer astrazeneca ronavirus vaccine trial dies brazil poole volunteer astrazeneca ronavirus vaccine trial dies brazil
812,3,yess needs happen
473,3,reminder human beings never disvered safe effective vaccine ronavirus reminder human beings never disvered safe effective vaccine ronavirus
,cluster,text
31,4,a volunteer clinical trial vid 19 vaccine developed astrazeneca oxford university died buta volunteer clinical trial vid 19 vaccine developed astrazeneca oxford university died testing ntinue
798,4,volunteer oxford vid 19 vaccine trial died brazil health authority says
309,4,i ready ready
710,4,unless vaccine astrazeneca modified retested remain unsafe unless vaccine astrazeneca modified retested remain unsafe
314,4,i sure paralyzed sterile children africa india celebrating they
216,4,eight persistent myths people believe human made virus vaccine nspiracy
360,4,irrespective of
513,4,please wake tom piece cloth harmful nothing stop virus spread next ll
398,4,lorado vid 19 vaccine volunteer brazil astrazeneca trial dies 14 21 cnn newsroom lorado vid 19 vaccine volunteer brazil astrazeneca trial dies 14 21 cnn newsroom
701,4,typical irresponsible paisan bs washington post well aware people read the
,cluster,text
241,5,avoiding flu shot due vid made easier ever get flu shot without going into
465,5,docs flu shot increase risk severe vid outme the
1045,5,mama hurry let vaccine market announce mp going bypoll
1584,5,that makes bad
322,5,brazil uld launch chinese vid 19 vaccine year governor 来自 brazil uld launch chinese vid 19 vaccine year governor 来自
1346,5,president jair bolsonaro said untry buy ronavirus vaccine developed thepresident jair bolsonaro said untry buy ronavirus vaccine developed chinese mpany sinovac
143,5,amen amen
558,5,fake placebo meningitis vaccine may killed healthy 28 year old brazilian vid vaccine volunteer fake placebo meningitis vaccine may killed healthy 28 year old brazilian vid vaccine volunteer
345,5,brazilian prez bolsonaro rejects chinese vaccine vid says brazilian people guineabrazilian prez bolsonaro rejects chinese vaccine vid says brazilian people guinea pig
1181,5,not good sign enforcing mandatory vax
,cluster,text
89,6,biden says ronavirus vaccine must freely available everyone dean
405,6,news team used recently developed techniques validate accuratelynews team used recently developed techniques validate accurately follows genetic instructions programmed team
139,6,daily exactly test vid vaccine politicians they
689,6,this unbelievable trump administration shut vaccine safety office last year plan
792,6,way stop respiratory virus like flu bill
1,6,1 know someone trial developed the
157,6,encabezado de hoy trump administration shut vaccine safety office last year plan
642,6,the vid vaccine must free available everyone imagine americans knowing healthcare
631,6,the trump administration shut vaccine safety office last year plan the
88,6,biden says ronavirus vaccine must freely available everyone cnnpolitics
